[2024-12-08 10:02:08,927] [INFO] [real_accelerator.py:219:get_accelerator] Setting ds_accelerator to cuda (auto detect)
Warning: The cache directory for DeepSpeed Triton autotune, /scratch/zl5604/triton_cache, appears to be on an NFS system. While this is generally acceptable, if you experience slowdowns or hanging when DeepSpeed exits, it is recommended to set the TRITON_CACHE_DIR environment variable to a non-NFS path.
[2024-12-08 10:02:18,632] [WARNING] [runner.py:215:fetch_hostfile] Unable to find hostfile, will proceed with training with local resources only.
Detected VISIBLE_DEVICES=0: setting --include=localhost:0
[2024-12-08 10:02:18,632] [INFO] [runner.py:607:main] cmd = /ext3/miniforge3/envs/deepspeed/bin/python3.12 -u -m deepspeed.launcher.launch --world_info=eyJsb2NhbGhvc3QiOiBbMF19 --master_addr=127.0.0.1 --master_port=29500 --enable_each_rank_log=None train_gpt2_small_deepspeed.py
[2024-12-08 10:02:20,425] [INFO] [real_accelerator.py:219:get_accelerator] Setting ds_accelerator to cuda (auto detect)
Warning: The cache directory for DeepSpeed Triton autotune, /scratch/zl5604/triton_cache, appears to be on an NFS system. While this is generally acceptable, if you experience slowdowns or hanging when DeepSpeed exits, it is recommended to set the TRITON_CACHE_DIR environment variable to a non-NFS path.
[2024-12-08 10:02:23,095] [INFO] [launch.py:139:main] 0 NV_LIBNCCL_DEV_PACKAGE=libnccl-dev=2.17.1-1+cuda12.1
[2024-12-08 10:02:23,095] [INFO] [launch.py:139:main] 0 NV_LIBNCCL_DEV_PACKAGE_VERSION=2.17.1-1
[2024-12-08 10:02:23,095] [INFO] [launch.py:139:main] 0 NCCL_VERSION=2.17.1-1
[2024-12-08 10:02:23,095] [INFO] [launch.py:139:main] 0 NV_LIBNCCL_DEV_PACKAGE_NAME=libnccl-dev
[2024-12-08 10:02:23,095] [INFO] [launch.py:139:main] 0 NV_LIBNCCL_PACKAGE=libnccl2=2.17.1-1+cuda12.1
[2024-12-08 10:02:23,095] [INFO] [launch.py:139:main] 0 NV_LIBNCCL_PACKAGE_NAME=libnccl2
[2024-12-08 10:02:23,095] [INFO] [launch.py:139:main] 0 NV_LIBNCCL_PACKAGE_VERSION=2.17.1-1
[2024-12-08 10:02:23,095] [INFO] [launch.py:146:main] WORLD INFO DICT: {'localhost': [0]}
[2024-12-08 10:02:23,095] [INFO] [launch.py:152:main] nnodes=1, num_local_procs=1, node_rank=0
[2024-12-08 10:02:23,095] [INFO] [launch.py:163:main] global_rank_mapping=defaultdict(<class 'list'>, {'localhost': [0]})
[2024-12-08 10:02:23,095] [INFO] [launch.py:164:main] dist_world_size=1
[2024-12-08 10:02:23,095] [INFO] [launch.py:168:main] Setting CUDA_VISIBLE_DEVICES=0
[2024-12-08 10:02:23,099] [INFO] [launch.py:256:main] process 5521 spawned with command: ['/ext3/miniforge3/envs/deepspeed/bin/python3.12', '-u', 'train_gpt2_small_deepspeed.py', '--local_rank=0']
[2024-12-08 10:02:26,587] [INFO] [real_accelerator.py:219:get_accelerator] Setting ds_accelerator to cuda (auto detect)
Warning: The cache directory for DeepSpeed Triton autotune, /scratch/zl5604/triton_cache, appears to be on an NFS system. While this is generally acceptable, if you experience slowdowns or hanging when DeepSpeed exits, it is recommended to set the TRITON_CACHE_DIR environment variable to a non-NFS path.
Current working directory: /scratch/zl5604/project
DeepSpeed specified local rank: 0; sbatch specified local rank: 0
TensorBoard logs path: ./tb_logs
[2024-12-08 10:02:34,448] [INFO] [logging.py:128:log_dist] [Rank -1] DeepSpeed info: version=0.16.0, git-hash=unknown, git-branch=unknown
[2024-12-08 10:02:34,448] [INFO] [comm.py:652:init_distributed] cdb=None
[2024-12-08 10:02:34,448] [INFO] [comm.py:683:init_distributed] Initializing TorchBackend in DeepSpeed with backend nccl
[2024-12-08 10:02:34,559] [INFO] [config.py:733:__init__] Config mesh_device None world_size = 1
[2024-12-08 10:02:35,795] [INFO] [logging.py:128:log_dist] [Rank 0] DeepSpeed Flops Profiler Enabled: False
Using /home/zl5604/.cache/torch_extensions/py312_cu121 as PyTorch extensions root...
Emitting ninja build file /home/zl5604/.cache/torch_extensions/py312_cu121/cpu_adam/build.ninja...
Building extension module cpu_adam...
Allowing ninja to set a default number of workers... (overridable by setting the environment variable MAX_JOBS=N)
ninja: no work to do.
Loading extension module cpu_adam...
Time to load cpu_adam op: 2.4230237007141113 seconds
Adam Optimizer #0 is created with AVX512 arithmetic capability.
Config: alpha=0.000150, betas=(0.900000, 0.950000), weight_decay=0.010000, adam_w=1
[2024-12-08 10:02:39,473] [INFO] [logging.py:128:log_dist] [Rank 0] Using DeepSpeed Optimizer param name adamw as basic optimizer
[2024-12-08 10:02:39,473] [INFO] [logging.py:128:log_dist] [Rank 0] Removing param_group that has no 'params' in the basic Optimizer
[2024-12-08 10:02:39,477] [INFO] [logging.py:128:log_dist] [Rank 0] DeepSpeed Basic Optimizer = DeepSpeedCPUAdam
[2024-12-08 10:02:39,477] [INFO] [utils.py:59:is_zero_supported_optimizer] Checking ZeRO support for optimizer=DeepSpeedCPUAdam type=<class 'deepspeed.ops.adam.cpu_adam.DeepSpeedCPUAdam'>
[2024-12-08 10:02:39,477] [INFO] [logging.py:128:log_dist] [Rank 0] Creating torch.float32 ZeRO stage 2 optimizer
[2024-12-08 10:02:39,477] [INFO] [stage_1_and_2.py:149:__init__] Reduce bucket size 500000000
[2024-12-08 10:02:39,477] [INFO] [stage_1_and_2.py:150:__init__] Allgather bucket size 500000000
[2024-12-08 10:02:39,478] [INFO] [stage_1_and_2.py:151:__init__] CPU Offload: True
[2024-12-08 10:02:39,478] [INFO] [stage_1_and_2.py:152:__init__] Round robin gradient partitioning: False
[2024-12-08 10:02:40,683] [INFO] [utils.py:781:see_memory_usage] Before initializing optimizer states
[2024-12-08 10:02:40,683] [INFO] [utils.py:782:see_memory_usage] MA 0.62 GB         Max_MA 0.62 GB         CA 0.62 GB         Max_CA 1 GB 
[2024-12-08 10:02:40,684] [INFO] [utils.py:789:see_memory_usage] CPU Virtual Memory:  used = 3.46 GB, percent = 7.4%
[2024-12-08 10:02:41,108] [INFO] [utils.py:781:see_memory_usage] After initializing optimizer states
[2024-12-08 10:02:41,109] [INFO] [utils.py:782:see_memory_usage] MA 0.62 GB         Max_MA 0.62 GB         CA 0.62 GB         Max_CA 1 GB 
[2024-12-08 10:02:41,109] [INFO] [utils.py:789:see_memory_usage] CPU Virtual Memory:  used = 3.98 GB, percent = 8.5%
[2024-12-08 10:02:41,109] [INFO] [stage_1_and_2.py:544:__init__] optimizer state initialized
[2024-12-08 10:02:41,266] [INFO] [utils.py:781:see_memory_usage] After initializing ZeRO optimizer
[2024-12-08 10:02:41,266] [INFO] [utils.py:782:see_memory_usage] MA 0.62 GB         Max_MA 0.62 GB         CA 0.62 GB         Max_CA 1 GB 
[2024-12-08 10:02:41,267] [INFO] [utils.py:789:see_memory_usage] CPU Virtual Memory:  used = 3.98 GB, percent = 8.5%
[2024-12-08 10:02:41,271] [INFO] [logging.py:128:log_dist] [Rank 0] DeepSpeed Final Optimizer = DeepSpeedZeroOptimizer
[2024-12-08 10:02:41,271] [WARNING] [lr_schedules.py:855:get_lr] Attempting to get learning rate from scheduler before it has started
[2024-12-08 10:02:41,271] [INFO] [logging.py:128:log_dist] [Rank 0] DeepSpeed using configured LR scheduler = WarmupCosineLR
[2024-12-08 10:02:41,271] [INFO] [logging.py:128:log_dist] [Rank 0] DeepSpeed LR Scheduler = <deepspeed.runtime.lr_schedules.WarmupCosineLR object at 0x14d1ae187cb0>
[2024-12-08 10:02:41,271] [INFO] [logging.py:128:log_dist] [Rank 0] step=0, skipped=0, lr=[0.0], mom=[[0.9, 0.95]]
[2024-12-08 10:02:41,271] [INFO] [config.py:999:print] DeepSpeedEngine configuration:
[2024-12-08 10:02:41,272] [INFO] [config.py:1003:print]   activation_checkpointing_config  {
    "partition_activations": false, 
    "contiguous_memory_optimization": false, 
    "cpu_checkpointing": false, 
    "number_checkpoints": null, 
    "synchronize_checkpoint_boundary": false, 
    "profile": false
}
[2024-12-08 10:02:41,272] [INFO] [config.py:1003:print]   aio_config ................... {'block_size': 1048576, 'queue_depth': 8, 'thread_count': 1, 'single_submit': False, 'overlap_events': True, 'use_gds': False}
[2024-12-08 10:02:41,272] [INFO] [config.py:1003:print]   amp_enabled .................. False
[2024-12-08 10:02:41,272] [INFO] [config.py:1003:print]   amp_params ................... False
[2024-12-08 10:02:41,272] [INFO] [config.py:1003:print]   autotuning_config ............ {
    "enabled": false, 
    "start_step": null, 
    "end_step": null, 
    "metric_path": null, 
    "arg_mappings": null, 
    "metric": "throughput", 
    "model_info": null, 
    "results_dir": "autotuning_results", 
    "exps_dir": "autotuning_exps", 
    "overwrite": true, 
    "fast": true, 
    "start_profile_step": 3, 
    "end_profile_step": 5, 
    "tuner_type": "gridsearch", 
    "tuner_early_stopping": 5, 
    "tuner_num_trials": 50, 
    "model_info_path": null, 
    "mp_size": 1, 
    "max_train_batch_size": null, 
    "min_train_batch_size": 1, 
    "max_train_micro_batch_size_per_gpu": 1.024000e+03, 
    "min_train_micro_batch_size_per_gpu": 1, 
    "num_tuning_micro_batch_sizes": 3
}
[2024-12-08 10:02:41,272] [INFO] [config.py:1003:print]   bfloat16_enabled ............. False
[2024-12-08 10:02:41,272] [INFO] [config.py:1003:print]   bfloat16_immediate_grad_update  False
[2024-12-08 10:02:41,272] [INFO] [config.py:1003:print]   checkpoint_parallel_write_pipeline  False
[2024-12-08 10:02:41,272] [INFO] [config.py:1003:print]   checkpoint_tag_validation_enabled  True
[2024-12-08 10:02:41,272] [INFO] [config.py:1003:print]   checkpoint_tag_validation_fail  False
[2024-12-08 10:02:41,272] [INFO] [config.py:1003:print]   comms_config ................. <deepspeed.comm.config.DeepSpeedCommsConfig object at 0x14d1ac91e240>
[2024-12-08 10:02:41,272] [INFO] [config.py:1003:print]   communication_data_type ...... None
[2024-12-08 10:02:41,272] [INFO] [config.py:1003:print]   compression_config ........... {'weight_quantization': {'shared_parameters': {'enabled': False, 'quantizer_kernel': False, 'schedule_offset': 0, 'quantize_groups': 1, 'quantize_verbose': False, 'quantization_type': 'symmetric', 'quantize_weight_in_forward': False, 'rounding': 'nearest', 'fp16_mixed_quantize': False, 'quantize_change_ratio': 0.001}, 'different_groups': {}}, 'activation_quantization': {'shared_parameters': {'enabled': False, 'quantization_type': 'symmetric', 'range_calibration': 'dynamic', 'schedule_offset': 1000}, 'different_groups': {}}, 'sparse_pruning': {'shared_parameters': {'enabled': False, 'method': 'l1', 'schedule_offset': 1000}, 'different_groups': {}}, 'row_pruning': {'shared_parameters': {'enabled': False, 'method': 'l1', 'schedule_offset': 1000}, 'different_groups': {}}, 'head_pruning': {'shared_parameters': {'enabled': False, 'method': 'topk', 'schedule_offset': 1000}, 'different_groups': {}}, 'channel_pruning': {'shared_parameters': {'enabled': False, 'method': 'l1', 'schedule_offset': 1000}, 'different_groups': {}}, 'layer_reduction': {'enabled': False}}
[2024-12-08 10:02:41,272] [INFO] [config.py:1003:print]   curriculum_enabled_legacy .... False
[2024-12-08 10:02:41,272] [INFO] [config.py:1003:print]   curriculum_params_legacy ..... False
[2024-12-08 10:02:41,272] [INFO] [config.py:1003:print]   data_efficiency_config ....... {'enabled': False, 'seed': 1234, 'data_sampling': {'enabled': False, 'num_epochs': 1000, 'num_workers': 0, 'curriculum_learning': {'enabled': False}}, 'data_routing': {'enabled': False, 'random_ltd': {'enabled': False, 'layer_token_lr_schedule': {'enabled': False}}}}
[2024-12-08 10:02:41,272] [INFO] [config.py:1003:print]   data_efficiency_enabled ...... False
[2024-12-08 10:02:41,272] [INFO] [config.py:1003:print]   dataloader_drop_last ......... False
[2024-12-08 10:02:41,272] [INFO] [config.py:1003:print]   disable_allgather ............ False
[2024-12-08 10:02:41,272] [INFO] [config.py:1003:print]   dump_state ................... False
[2024-12-08 10:02:41,272] [INFO] [config.py:1003:print]   dynamic_loss_scale_args ...... None
[2024-12-08 10:02:41,272] [INFO] [config.py:1003:print]   eigenvalue_enabled ........... False
[2024-12-08 10:02:41,272] [INFO] [config.py:1003:print]   eigenvalue_gas_boundary_resolution  1
[2024-12-08 10:02:41,272] [INFO] [config.py:1003:print]   eigenvalue_layer_name ........ bert.encoder.layer
[2024-12-08 10:02:41,272] [INFO] [config.py:1003:print]   eigenvalue_layer_num ......... 0
[2024-12-08 10:02:41,273] [INFO] [config.py:1003:print]   eigenvalue_max_iter .......... 100
[2024-12-08 10:02:41,273] [INFO] [config.py:1003:print]   eigenvalue_stability ......... 1e-06
[2024-12-08 10:02:41,273] [INFO] [config.py:1003:print]   eigenvalue_tol ............... 0.01
[2024-12-08 10:02:41,273] [INFO] [config.py:1003:print]   eigenvalue_verbose ........... False
[2024-12-08 10:02:41,273] [INFO] [config.py:1003:print]   elasticity_enabled ........... False
[2024-12-08 10:02:41,273] [INFO] [config.py:1003:print]   flops_profiler_config ........ {
    "enabled": false, 
    "recompute_fwd_factor": 0.0, 
    "profile_step": 1, 
    "module_depth": -1, 
    "top_modules": 1, 
    "detailed": true, 
    "output_file": null
}
[2024-12-08 10:02:41,273] [INFO] [config.py:1003:print]   fp16_auto_cast ............... None
[2024-12-08 10:02:41,273] [INFO] [config.py:1003:print]   fp16_enabled ................. False
[2024-12-08 10:02:41,273] [INFO] [config.py:1003:print]   fp16_master_weights_and_gradients  False
[2024-12-08 10:02:41,273] [INFO] [config.py:1003:print]   global_rank .................. 0
[2024-12-08 10:02:41,273] [INFO] [config.py:1003:print]   grad_accum_dtype ............. None
[2024-12-08 10:02:41,273] [INFO] [config.py:1003:print]   gradient_accumulation_steps .. 1
[2024-12-08 10:02:41,273] [INFO] [config.py:1003:print]   gradient_clipping ............ 1.0
[2024-12-08 10:02:41,273] [INFO] [config.py:1003:print]   gradient_predivide_factor .... 1.0
[2024-12-08 10:02:41,273] [INFO] [config.py:1003:print]   graph_harvesting ............. False
[2024-12-08 10:02:41,273] [INFO] [config.py:1003:print]   hybrid_engine ................ enabled=False max_out_tokens=512 inference_tp_size=1 release_inference_cache=False pin_parameters=True tp_gather_partition_size=8
[2024-12-08 10:02:41,273] [INFO] [config.py:1003:print]   initial_dynamic_scale ........ 65536
[2024-12-08 10:02:41,273] [INFO] [config.py:1003:print]   load_universal_checkpoint .... False
[2024-12-08 10:02:41,273] [INFO] [config.py:1003:print]   loss_scale ................... 0
[2024-12-08 10:02:41,273] [INFO] [config.py:1003:print]   memory_breakdown ............. False
[2024-12-08 10:02:41,273] [INFO] [config.py:1003:print]   mics_hierarchial_params_gather  False
[2024-12-08 10:02:41,273] [INFO] [config.py:1003:print]   mics_shard_size .............. -1
[2024-12-08 10:02:41,273] [INFO] [config.py:1003:print]   monitor_config ............... tensorboard=TensorBoardConfig(enabled=False, output_path='', job_name='DeepSpeedJobName') comet=CometConfig(enabled=False, samples_log_interval=100, project=None, workspace=None, api_key=None, experiment_name=None, experiment_key=None, online=None, mode=None) wandb=WandbConfig(enabled=False, group=None, team=None, project='deepspeed') csv_monitor=CSVConfig(enabled=False, output_path='', job_name='DeepSpeedJobName')
[2024-12-08 10:02:41,273] [INFO] [config.py:1003:print]   nebula_config ................ {
    "enabled": false, 
    "persistent_storage_path": null, 
    "persistent_time_interval": 100, 
    "num_of_version_in_retention": 2, 
    "enable_nebula_load": true, 
    "load_path": null
}
[2024-12-08 10:02:41,273] [INFO] [config.py:1003:print]   optimizer_legacy_fusion ...... False
[2024-12-08 10:02:41,273] [INFO] [config.py:1003:print]   optimizer_name ............... adamw
[2024-12-08 10:02:41,273] [INFO] [config.py:1003:print]   optimizer_params ............. {'lr': 0.00015, 'betas': [0.9, 0.95], 'weight_decay': 0.01}
[2024-12-08 10:02:41,273] [INFO] [config.py:1003:print]   pipeline ..................... {'stages': 'auto', 'partition': 'best', 'seed_layers': False, 'activation_checkpoint_interval': 0, 'pipe_partitioned': True, 'grad_partitioned': True}
[2024-12-08 10:02:41,273] [INFO] [config.py:1003:print]   pld_enabled .................. False
[2024-12-08 10:02:41,273] [INFO] [config.py:1003:print]   pld_params ................... False
[2024-12-08 10:02:41,273] [INFO] [config.py:1003:print]   prescale_gradients ........... False
[2024-12-08 10:02:41,273] [INFO] [config.py:1003:print]   scheduler_name ............... WarmupCosineLR
[2024-12-08 10:02:41,273] [INFO] [config.py:1003:print]   scheduler_params ............. {'warmup_min_ratio': 0.1, 'cos_min_ratio': 0.001, 'warmup_num_steps': 3, 'total_num_steps': 31}
[2024-12-08 10:02:41,273] [INFO] [config.py:1003:print]   seq_parallel_communication_data_type  torch.float32
[2024-12-08 10:02:41,273] [INFO] [config.py:1003:print]   sparse_attention ............. None
[2024-12-08 10:02:41,273] [INFO] [config.py:1003:print]   sparse_gradients_enabled ..... False
[2024-12-08 10:02:41,273] [INFO] [config.py:1003:print]   steps_per_print .............. None
[2024-12-08 10:02:41,274] [INFO] [config.py:1003:print]   timers_config ................ enabled=True synchronized=True
[2024-12-08 10:02:41,274] [INFO] [config.py:1003:print]   train_batch_size ............. 8
[2024-12-08 10:02:41,274] [INFO] [config.py:1003:print]   train_micro_batch_size_per_gpu  8
[2024-12-08 10:02:41,274] [INFO] [config.py:1003:print]   use_data_before_expert_parallel_  False
[2024-12-08 10:02:41,274] [INFO] [config.py:1003:print]   use_node_local_storage ....... False
[2024-12-08 10:02:41,274] [INFO] [config.py:1003:print]   wall_clock_breakdown ......... False
[2024-12-08 10:02:41,274] [INFO] [config.py:1003:print]   weight_quantization_config ... None
[2024-12-08 10:02:41,274] [INFO] [config.py:1003:print]   world_size ................... 1
[2024-12-08 10:02:41,274] [INFO] [config.py:1003:print]   zero_allow_untested_optimizer  False
[2024-12-08 10:02:41,274] [INFO] [config.py:1003:print]   zero_config .................. stage=2 contiguous_gradients=True reduce_scatter=True reduce_bucket_size=500000000 use_multi_rank_bucket_allreduce=True allgather_partitions=True allgather_bucket_size=500000000 overlap_comm=True load_from_fp32_weights=True elastic_checkpoint=False offload_param=None offload_optimizer=DeepSpeedZeroOffloadOptimizerConfig(device='cpu', nvme_path=None, buffer_count=4, pin_memory=True, pipeline_read=False, pipeline_write=False, fast_init=False, ratio=1.0) sub_group_size=1000000000 cpu_offload_param=None cpu_offload_use_pin_memory=None cpu_offload=None prefetch_bucket_size=50000000 param_persistence_threshold=100000 model_persistence_threshold=9223372036854775807 max_live_parameters=1000000000 max_reuse_distance=1000000000 gather_16bit_weights_on_model_save=False module_granularity_threshold=0 use_all_reduce_for_fetch_params=False stage3_gather_fp16_weights_on_model_save=False ignore_unused_parameters=True legacy_stage1=False round_robin_gradients=False zero_hpz_partition_size=1 zero_quantized_weights=False zero_quantized_nontrainable_weights=False zero_quantized_gradients=False mics_shard_size=-1 mics_hierarchical_params_gather=False memory_efficient_linear=True pipeline_loading_checkpoint=False override_module_apply=True
[2024-12-08 10:02:41,274] [INFO] [config.py:1003:print]   zero_enabled ................. True
[2024-12-08 10:02:41,274] [INFO] [config.py:1003:print]   zero_force_ds_cpu_optimizer .. True
[2024-12-08 10:02:41,274] [INFO] [config.py:1003:print]   zero_optimization_stage ...... 2
[2024-12-08 10:02:41,274] [INFO] [config.py:989:print_user_config]   json = {
    "train_batch_size": 8, 
    "gradient_accumulation_steps": 1, 
    "fp16": {
        "enabled": false
    }, 
    "optimizer": {
        "type": "AdamW", 
        "params": {
            "lr": 0.00015, 
            "betas": [0.9, 0.95], 
            "weight_decay": 0.01
        }
    }, 
    "scheduler": {
        "type": "WarmupCosineLR", 
        "params": {
            "warmup_min_ratio": 0.1, 
            "cos_min_ratio": 0.001, 
            "warmup_num_steps": 3, 
            "total_num_steps": 31
        }
    }, 
    "gradient_clipping": 1.0, 
    "zero_optimization": {
        "stage": 2, 
        "offload_optimizer": {
            "device": "cpu", 
            "pin_memory": true
        }, 
        "overlap_comm": true
    }
}
wandb: Using wandb-core as the SDK backend.  Please refer to https://wandb.me/wandb-core for more information.
wandb: Currently logged in as: ziyil0323. Use `wandb login --relogin` to force relogin
wandb: Tracking run with wandb version 0.18.7
wandb: Run data is saved locally in /scratch/zl5604/project/wandb/run-20241208_100500-5dngz07r
wandb: Run `wandb offline` to turn off syncing.
wandb: Syncing run playful-cloud-6
wandb: ⭐️ View project at https://wandb.ai/ziyil0323/gpt2-benchmark%20deepspeed
wandb: 🚀 View run at https://wandb.ai/ziyil0323/gpt2-benchmark%20deepspeed/runs/5dngz07r
Profiler initialized
Training:   0%|                                                     | 0/31 [00:00<?, ?it/s]Training:   3%|█▍                                           | 1/31 [00:05<02:46,  5.56s/it]Training:   6%|██▉                                          | 2/31 [00:06<01:27,  3.00s/it]Training:  10%|████▎                                        | 3/31 [00:07<01:00,  2.18s/it]Training:  13%|█████▊                                       | 4/31 [00:09<00:48,  1.79s/it]Training:  16%|███████▎                                     | 5/31 [00:10<00:41,  1.58s/it]Training:  19%|████████▋                                    | 6/31 [00:11<00:36,  1.45s/it]Training:  23%|██████████▏                                  | 7/31 [00:12<00:33,  1.38s/it]Training:  26%|███████████▌                                 | 8/31 [00:14<00:30,  1.33s/it]Training:  29%|█████████████                                | 9/31 [00:15<00:28,  1.30s/it]Training:  32%|██████████████▏                             | 10/31 [00:16<00:26,  1.28s/it]Training:  35%|███████████████▌                            | 11/31 [00:17<00:25,  1.27s/it]Training:  39%|█████████████████                           | 12/31 [00:18<00:23,  1.26s/it]Training:  42%|██████████████████▍                         | 13/31 [00:20<00:22,  1.25s/it]Training:  45%|███████████████████▊                        | 14/31 [00:21<00:21,  1.24s/it]Training:  48%|█████████████████████▎                      | 15/31 [00:22<00:19,  1.24s/it][rank0]:[W1208 10:05:25.658872886 CPUAllocator.cpp:249] Memory block of unknown size was allocated before the profiling started, profiler results will not include the deallocation event
Step 15: loss 2.550994634628296
Average learning rate: 8.346393837204032e-05
elapsed_time_per_iteration: 1.5940271695454915s
Throughput average on 15: 4.391116730335155
Torch reports memory usage: 651.70654296875 MB
GPUtil reports memory usage: 
+----+-----------+----------+------------------+------------------+-------------------+------------------+
| ID |   Name    | Load (%) | Free Memory (MB) | Used Memory (MB) | Total Memory (MB) | Temperature (°C) |
+----+-----------+----------+------------------+------------------+-------------------+------------------+
| 0  | NVIDIA L4 |  44.0%   |      1200.0      |     21395.0      |      23034.0      |      52.0°C      |
+----+-----------+----------+------------------+------------------+-------------------+------------------+

Validation:   0%|                                                   | 0/10 [00:00<?, ?it/s][A
Validation:  10%|████▎                                      | 1/10 [00:00<00:04,  2.24it/s][A
Validation:  20%|████████▌                                  | 2/10 [00:00<00:03,  2.51it/s][A
Validation:  30%|████████████▉                              | 3/10 [00:01<00:02,  2.59it/s][A
Validation:  40%|█████████████████▏                         | 4/10 [00:01<00:02,  2.63it/s][A
Validation:  50%|█████████████████████▌                     | 5/10 [00:01<00:01,  2.67it/s][A
Validation:  60%|█████████████████████████▊                 | 6/10 [00:02<00:01,  2.69it/s][A
Validation:  70%|██████████████████████████████             | 7/10 [00:02<00:01,  2.68it/s][A
Validation:  80%|██████████████████████████████████▍        | 8/10 [00:03<00:00,  2.69it/s][A
Validation:  90%|██████████████████████████████████████▋    | 9/10 [00:03<00:00,  2.70it/s][A
Validation: 100%|██████████████████████████████████████████| 10/10 [00:03<00:00,  2.69it/s][AValidation: 100%|██████████████████████████████████████████| 10/10 [00:03<00:00,  2.63it/s]
Validation loss: 2.3079623222351073, Perplexity: 10.053917124864904
Checkpoint saved at ./checkpoints/checkpoint-15
Training:  52%|██████████████████████▋                     | 16/31 [00:30<00:47,  3.19s/it]Training:  55%|████████████████████████▏                   | 17/31 [00:31<00:37,  2.64s/it]Training:  58%|█████████████████████████▌                  | 18/31 [00:33<00:28,  2.23s/it]Training:  61%|██████████████████████████▉                 | 19/31 [00:34<00:23,  1.94s/it]Training:  65%|████████████████████████████▍               | 20/31 [00:35<00:19,  1.74s/it]Training:  68%|█████████████████████████████▊              | 21/31 [00:36<00:15,  1.60s/it]Training:  71%|███████████████████████████████▏            | 22/31 [00:38<00:13,  1.50s/it]Training:  74%|████████████████████████████████▋           | 23/31 [00:39<00:11,  1.43s/it]Training:  77%|██████████████████████████████████          | 24/31 [00:40<00:09,  1.39s/it]Training:  81%|███████████████████████████████████▍        | 25/31 [00:47<00:18,  3.01s/it]Training:  84%|████████████████████████████████████▉       | 26/31 [00:48<00:12,  2.48s/it]Training:  87%|██████████████████████████████████████▎     | 27/31 [00:49<00:08,  2.11s/it]Training:  90%|███████████████████████████████████████▋    | 28/31 [00:51<00:05,  1.85s/it]Training:  94%|█████████████████████████████████████████▏  | 29/31 [00:52<00:03,  1.67s/it]Training:  97%|██████████████████████████████████████████▌ | 30/31 [00:53<00:01,  1.54s/it]Step 30: loss 2.3322689533233643
Average learning rate: 1.5e-07
elapsed_time_per_iteration: 0.9017935991287231s
Throughput average on 15: 7.761819755166475
Torch reports memory usage: 651.70654296875 MB
GPUtil reports memory usage: 
+----+-----------+----------+------------------+------------------+-------------------+------------------+
| ID |   Name    | Load (%) | Free Memory (MB) | Used Memory (MB) | Total Memory (MB) | Temperature (°C) |
+----+-----------+----------+------------------+------------------+-------------------+------------------+
| 0  | NVIDIA L4 |  100.0%  |      1040.0      |     21555.0      |      23034.0      |      56.0°C      |
+----+-----------+----------+------------------+------------------+-------------------+------------------+

Validation:   0%|                                                   | 0/10 [00:00<?, ?it/s][A
Validation:  10%|████▎                                      | 1/10 [00:00<00:04,  2.16it/s][A
Validation:  20%|████████▌                                  | 2/10 [00:00<00:03,  2.49it/s][A
Validation:  30%|████████████▉                              | 3/10 [00:01<00:02,  2.57it/s][A
Validation:  40%|█████████████████▏                         | 4/10 [00:01<00:02,  2.61it/s][A
Validation:  50%|█████████████████████▌                     | 5/10 [00:01<00:01,  2.63it/s][A
Validation:  60%|█████████████████████████▊                 | 6/10 [00:02<00:01,  2.67it/s][A
Validation:  70%|██████████████████████████████             | 7/10 [00:02<00:01,  2.66it/s][A
Validation:  80%|██████████████████████████████████▍        | 8/10 [00:03<00:00,  2.66it/s][A
Validation:  90%|██████████████████████████████████████▋    | 9/10 [00:03<00:00,  2.67it/s][A
Validation: 100%|██████████████████████████████████████████| 10/10 [00:03<00:00,  2.68it/s][AValidation: 100%|██████████████████████████████████████████| 10/10 [00:03<00:00,  2.60it/s]
Validation loss: 2.2888731360435486, Perplexity: 9.863816237182109
Checkpoint saved at ./checkpoints/checkpoint-30
Training: 100%|████████████████████████████████████████████| 31/31 [01:02<00:00,  3.63s/it]Training: 100%|████████████████████████████████████████████| 31/31 [01:02<00:00,  2.01s/it]
-------------------------------------------------------  ------------  ------------  ------------  ------------  ------------  ------------  ------------  ------------  ------------  ------------  ------------  ------------  ------------  ------------  
                                                   Name    Self CPU %      Self CPU   CPU total %     CPU total  CPU time avg     Self CUDA   Self CUDA %    CUDA total  CUDA time avg       CPU Mem  Self CPU Mem      CUDA Mem  Self CUDA Mem    # of Calls  
-------------------------------------------------------  ------------  ------------  ------------  ------------  ------------  ------------  ------------  ------------  ------------  ------------  ------------  ------------  ------------  ------------  
                                          ProfilerStep*         0.00%       0.000us         0.00%       0.000us       0.000us       20.370s       132.46%       20.370s        1.018s           0 b           0 b           0 b           0 b            20  
                                               aten::mm         0.15%      30.092ms         0.24%      47.964ms      47.964us        5.068s        32.96%        5.068s       5.068ms           0 b           0 b      55.29 Gb      55.29 Gb          1000  
                                            aten::addmm         0.22%      44.738ms         0.34%      68.920ms      71.792us        2.304s        14.98%        2.304s       2.400ms           0 b           0 b      50.62 Gb      50.53 Gb           960  
void cutlass::Kernel<cutlass_80_simt_sgemm_256x128_8...         0.00%       0.000us         0.00%       0.000us       0.000us        1.876s        12.20%        1.876s       3.828ms           0 b           0 b           0 b           0 b           490  
                                              aten::mul         0.16%      33.364ms         0.28%      56.915ms      29.038us        1.821s        11.84%        1.821s     929.068us          80 b           0 b     171.56 Gb     171.47 Gb          1960  
                                ampere_sgemm_128x128_tn         0.00%       0.000us         0.00%       0.000us       0.000us        1.674s        10.89%        1.674s      83.708ms           0 b           0 b           0 b           0 b            20  
                                            aten::copy_         0.32%      64.210ms         3.55%     720.239ms     115.404us        1.657s        10.78%        1.657s     265.502us           0 b           0 b           0 b           0 b          6241  
                                 ampere_sgemm_128x64_tn         0.00%       0.000us         0.00%       0.000us       0.000us        1.305s         8.49%        1.305s       2.719ms           0 b           0 b           0 b           0 b           480  
void at::native::vectorized_elementwise_kernel<4, at...         0.00%       0.000us         0.00%       0.000us       0.000us        1.017s         6.61%        1.017s     833.479us           0 b           0 b           0 b           0 b          1220  
                    aten::_efficient_attention_backward         0.03%       6.089ms         2.67%     540.771ms       4.506ms     900.834ms         5.86%     950.124ms       7.918ms           0 b           0 b       8.44 Gb      -5.72 Gb           120  
-------------------------------------------------------  ------------  ------------  ------------  ------------  ------------  ------------  ------------  ------------  ------------  ------------  ------------  ------------  ------------  ------------  
Self CPU time total: 20.262s
Self CUDA time total: 15.378s

Total Device Time: 81570.79 ms
Total CPU Time: 76438.90 ms
Validation:   0%|                                                   | 0/10 [00:00<?, ?it/s]Validation:  10%|████▎                                      | 1/10 [00:00<00:04,  2.14it/s]Validation:  20%|████████▌                                  | 2/10 [00:00<00:03,  2.49it/s]Validation:  30%|████████████▉                              | 3/10 [00:01<00:02,  2.57it/s]Validation:  40%|█████████████████▏                         | 4/10 [00:01<00:02,  2.62it/s]Validation:  50%|█████████████████████▌                     | 5/10 [00:01<00:01,  2.65it/s]Validation:  60%|█████████████████████████▊                 | 6/10 [00:02<00:01,  2.75it/s]Validation:  70%|██████████████████████████████             | 7/10 [00:02<00:01,  2.69it/s]Validation:  80%|██████████████████████████████████▍        | 8/10 [00:03<00:00,  2.70it/s]Validation:  90%|██████████████████████████████████████▋    | 9/10 [00:03<00:00,  2.70it/s]Validation: 100%|██████████████████████████████████████████| 10/10 [00:03<00:00,  2.70it/s]Validation: 100%|██████████████████████████████████████████| 10/10 [00:03<00:00,  2.62it/s]
Final Validation loss: 2.2888731360435486, Perplexity: 9.863816237182109
[rank0]:[W1208 10:06:29.603995152 ProcessGroupNCCL.cpp:4115] [PG ID 0 PG GUID 0 Rank 0]  using GPU 0 to perform barrier as devices used by this process are currently unknown. This can potentially cause a hang if this rank to GPU mapping is incorrect.Specify device_ids in barrier() to force use of a particular device,or call init_process_group() with a device_id.
[2024-12-08 10:06:29,538] [INFO] [logging.py:128:log_dist] [Rank 0] [Torch] Checkpoint global_step31 is about to be saved!
[2024-12-08 10:06:29,548] [INFO] [logging.py:128:log_dist] [Rank 0] Saving model checkpoint: ./checkpoints/checkpoint-31/global_step31/mp_rank_00_model_states.pt
[2024-12-08 10:06:29,548] [INFO] [torch_checkpoint_engine.py:21:save] [Torch] Saving ./checkpoints/checkpoint-31/global_step31/mp_rank_00_model_states.pt...
[2024-12-08 10:06:31,917] [INFO] [torch_checkpoint_engine.py:23:save] [Torch] Saved ./checkpoints/checkpoint-31/global_step31/mp_rank_00_model_states.pt.
[2024-12-08 10:06:31,919] [INFO] [torch_checkpoint_engine.py:21:save] [Torch] Saving ./checkpoints/checkpoint-31/global_step31/zero_pp_rank_0_mp_rank_00_optim_states.pt...
[2024-12-08 10:06:38,761] [INFO] [torch_checkpoint_engine.py:23:save] [Torch] Saved ./checkpoints/checkpoint-31/global_step31/zero_pp_rank_0_mp_rank_00_optim_states.pt.
[2024-12-08 10:06:38,776] [INFO] [engine.py:3567:_save_zero_checkpoint] zero checkpoint saved ./checkpoints/checkpoint-31/global_step31/zero_pp_rank_0_mp_rank_00_optim_states.pt
[2024-12-08 10:06:38,776] [INFO] [torch_checkpoint_engine.py:33:commit] [Torch] Checkpoint global_step31 is ready now!
Final checkpoint saved at ./checkpoints/checkpoint-31
wandb:                                                                                
wandb: 
wandb: Run history:
wandb:       iteration-time █▁
wandb:        learning-rate █▁
wandb:                 loss █▁
wandb:         memory-usage ▁▁
wandb:           perplexity █▁▁
wandb:           throughput ▁█
wandb:    total_cpu_time_ms ▁
wandb: total_device_time_ms ▁
wandb:      validation_loss █▁▁
wandb: 
wandb: Run summary:
wandb:       iteration-time 0.90179
wandb:        learning-rate 0.0
wandb:                 loss 2.33227
wandb:         memory-usage 651.70654
wandb:           perplexity 9.86382
wandb:           throughput 7.76182
wandb:    total_cpu_time_ms 76438.90122
wandb: total_device_time_ms 81570.78725
wandb:      validation_loss 2.28887
wandb: 
wandb: 🚀 View run playful-cloud-6 at: https://wandb.ai/ziyil0323/gpt2-benchmark%20deepspeed/runs/5dngz07r
wandb: ⭐️ View project at: https://wandb.ai/ziyil0323/gpt2-benchmark%20deepspeed
wandb: Synced 5 W&B file(s), 0 media file(s), 2 artifact file(s) and 1 other file(s)
wandb: Find logs at: ./wandb/run-20241208_100500-5dngz07r/logs
[2024-12-08 10:06:47,135] [INFO] [launch.py:351:main] Process 5521 exits successfully.
/bin/bash: line 7: --micro-batch-size: command not found
/bin/bash: line 8: --global-batch-size: command not found
/bin/bash: line 9: --train-iters: command not found
/bin/bash: line 10: --log-interval: command not found
/bin/bash: line 11: --eval-interval: command not found
/bin/bash: line 12: --save-interval: command not found
/bin/bash: line 13: --log-throughput: command not found
/bin/bash: line 14: --log-timers-to-tensorboard: command not found
/bin/bash: line 15: --num-gpus: command not found
/bin/bash: line 16: --num-nodes: command not found
/bin/bash: line 17: --seed: command not found
